職業,事件名稱,事件內容,屬性,等級,影響
從政,引發全國癱瘓的階級大罷工,引發全國癱瘓的階級大罷工。政治抹黑、派系鬥爭、刺客的冷槍或者核心幕僚的集體背叛，讓你身處波譎雲詭的權力漩渦邊緣。官僚內耗與不信任危機如影隨形，稍微踩錯一步棋便可能面臨免職下台乃至牢獄之災。,"財富:中性,快樂:中性,名譽:負向",普通,"0,0,-2"
從政,被瘋狂刺殺的驚險瞬間,被瘋狂刺殺的驚險瞬間。政治抹黑、派系鬥爭、刺客的冷槍或者核心幕僚的集體背叛，讓你身處波譎雲詭的權力漩渦邊緣。官僚內耗與不信任危機如影隨形，稍微踩錯一步棋便可能面臨免職下台乃至牢獄之災。,"財富:負向,快樂:中性,名譽:中性",普通,"-18,0,0"
從政,審計署發起的財務倒查,審計署發起的財務倒查。政治抹黑、派系鬥爭、刺客的冷槍或者核心幕僚的集體背叛，讓你身處波譎雲詭的權力漩渦邊緣。官僚內耗與不信任危機如影隨形，稍微踩錯一步棋便可能面臨免職下台乃至牢獄之災。,"財富:中性,快樂:中性,名譽:負向",普通,"0,0,-1"
從政,媒體挖出多年前的言論污點,媒體挖出多年前的言論污點。政治抹黑、派系鬥爭、刺客的冷槍或者核心幕僚的集體背叛，讓你身處波譎雲詭的權力漩渦邊緣。官僚內耗與不信任危機如影隨形，稍微踩錯一步棋便可能面臨免職下台乃至牢獄之災。,"財富:中性,快樂:負向,名譽:中性",普通,"0,-2,0"
從政,政策失誤引發的街頭抗議狂潮,政策失誤引發的街頭抗議狂潮。政治抹黑、派系鬥爭、刺客的冷槍或者核心幕僚的集體背叛，讓你身處波譎雲詭的權力漩渦邊緣。官僚內耗與不信任危機如影隨形，稍微踩錯一步棋便可能面臨免職下台乃至牢獄之災。,"財富:中性,快樂:中性,名譽:負向",普通,"0,0,-1"
從政,被上級無情奪走的政績成果,被上級無情奪走的政績成果。政治抹黑、派系鬥爭、刺客的冷槍或者核心幕僚的集體背叛，讓你身處波譎雲詭的權力漩渦邊緣。官僚內耗與不信任危機如影隨形，稍微踩錯一步棋便可能面臨免職下台乃至牢獄之災。,"財富:中性,快樂:中性,名譽:負向",普通,"0,0,-1"
從政,核心選區的集體倒戈危機,核心選區的集體倒戈危機。政治抹黑、派系鬥爭、刺客的冷槍或者核心幕僚的集體背叛，讓你身處波譎雲詭的權力漩渦邊緣。官僚內耗與不信任危機如影隨形，稍微踩錯一步棋便可能面臨免職下台乃至牢獄之災。,"財富:中性,快樂:負向,名譽:中性",普通,"0,-2,0"
從政,被惡意設計的腐敗陷阱,被惡意設計的腐敗陷阱。政治抹黑、派系鬥爭、刺客的冷槍或者核心幕僚的集體背叛，讓你身處波譎雲詭的權力漩渦邊緣。官僚內耗與不信任危機如影隨形，稍微踩錯一步棋便可能面臨免職下台乃至牢獄之災。,"財富:負向,快樂:中性,名譽:中性",普通,"-16,0,0"
從政,大選前夕的抹黑風暴,大選前夕的抹黑風暴。政治抹黑、派系鬥爭、刺客的冷槍或者核心幕僚的集體背叛，讓你身處波譎雲詭的權力漩渦邊緣。官僚內耗與不信任危機如影隨形，稍微踩錯一步棋便可能面臨免職下台乃至牢獄之災。,"財富:負向,快樂:中性,名譽:中性",普通,"-13,0,0"
從政,派系鬥爭的替罪羊危機,派系鬥爭的替罪羊危機。政治抹黑、派系鬥爭、刺客的冷槍或者核心幕僚的集體背叛，讓你身處波譎雲詭的權力漩渦邊緣。官僚內耗與不信任危機如影隨形，稍微踩錯一步棋便可能面臨免職下台乃至牢獄之災。,"財富:中性,快樂:中性,名譽:負向",普通,"0,0,-2"
從政,引資項目的村民集體暴動,引資項目的村民集體暴動。政治抹黑、派系鬥爭、刺客的冷槍或者核心幕僚的集體背叛，讓你身處波譎雲詭的權力漩渦邊緣。官僚內耗與不信任危機如影隨形，稍微踩錯一步棋便可能面臨免職下台乃至牢獄之災。,"財富:中性,快樂:負向,名譽:中性",普通,"0,-1,0"
從政,跨國犯罪集團的私下恐嚇,跨國犯罪集團的私下恐嚇。政治抹黑、派系鬥爭、刺客的冷槍或者核心幕僚的集體背叛，讓你身處波譎雲詭的權力漩渦邊緣。官僚內耗與不信任危機如影隨形，稍微踩錯一步棋便可能面臨免職下台乃至牢獄之災。,"財富:中性,快樂:負向,名譽:中性",普通,"0,-1,0"
從政,街坊鄰里的自發擁護,街坊鄰里的自發擁護。民意狂瀾與精妙的治國良策將你推上了權力的巔峰。基層選民的由衷擁護、歷史性福利法案的通過，或是外交談判上的縱橫捭闔，讓你成為了國家的脊梁，政壇滿意度高居不下，迎來了海量政治聲譽與榮光。,"財富:中性,快樂:正向,名譽:正向",稀有,"0,3,4"
從政,破冰的歷史性法案,破冰的歷史性法案。民意狂瀾與精妙的治國良策將你推上了權力的巔峰。基層選民的由衷擁護、歷史性福利法案的通過，或是外交談判上的縱橫捭闔，讓你成為了國家的脊梁，政壇滿意度高居不下，迎來了海量政治聲譽與榮光。,"財富:中性,快樂:正向,名譽:正向",稀有,"0,3,2"
從政,深夜路燈下的擁抱,深夜路燈下的擁抱。民意狂瀾與精妙的治國良策將你推上了權力的巔峰。基層選民的由衷擁護、歷史性福利法案的通過，或是外交談判上的縱橫捭闔，讓你成為了國家的脊梁，政壇滿意度高居不下，迎來了海量政治聲譽與榮光。,"財富:中性,快樂:中性,名譽:正向",稀有,"0,0,2"
從政,政府績效考核的驚喜第一,政府績效考核的驚喜第一。民意狂瀾與精妙的治國良策將你推上了權力的巔峰。基層選民的由衷擁護、歷史性福利法案的通過，或是外交談判上的縱橫捭闔，讓你成為了國家的脊梁，政壇滿意度高居不下，迎來了海量政治聲譽與榮光。,"財富:正向,快樂:中性,名譽:正向",稀有,"36,0,2"
從政,一杯清茶平息的百年宗族怨,一杯清茶平息的百年宗族怨。民意狂瀾與精妙的治國良策將你推上了權力的巔峰。基層選民的由衷擁護、歷史性福利法案的通過，或是外交談判上的縱橫捭闔，讓你成為了國家的脊梁，政壇滿意度高居不下，迎來了海量政治聲譽與榮光。,"財富:中性,快樂:正向,名譽:正向",稀有,"0,2,2"
從政,捕捉時代痛點的萬字建議書,捕捉時代痛點的萬字建議書。民意狂瀾與精妙的治國良策將你推上了權力的巔峰。基層選民的由衷擁護、歷史性福利法案的通過，或是外交談判上的縱橫捭闔，讓你成為了國家的脊梁，政壇滿意度高居不下，迎來了海量政治聲譽與榮光。,"財富:正向,快樂:正向,名譽:中性",稀有,"35,3,0"
從政,公民聯署的驚人狂瀾,公民聯署的驚人狂瀾。民意狂瀾與精妙的治國良策將你推上了權力的巔峰。基層選民的由衷擁護、歷史性福利法案的通過，或是外交談判上的縱橫捭闔，讓你成為了國家的脊梁，政壇滿意度高居不下，迎來了海量政治聲譽與榮光。,"財富:中性,快樂:中性,名譽:正向",稀有,"0,0,4"
從政,陽光法案的幕後推手,陽光法案的幕後推手。民意狂瀾與精妙的治國良策將你推上了權力的巔峰。基層選民的由衷擁護、歷史性福利法案的通過，或是外交談判上的縱橫捭闔，讓你成為了國家的脊梁，政壇滿意度高居不下，迎來了海量政治聲譽與榮光。,"財富:中性,快樂:正向,名譽:中性",稀有,"0,2,0"
從政,特定議題的媒體高光,特定議題的媒體高光。民意狂瀾與精妙的治國良策將你推上了權力的巔峰。基層選民的由衷擁護、歷史性福利法案的通過，或是外交談判上的縱橫捭闔，讓你成為了國家的脊梁，政壇滿意度高居不下，迎來了海量政治聲譽與榮光。,"財富:中性,快樂:中性,名譽:正向",稀有,"0,0,3"
從政,社會觀察家的犀利排雷,社會觀察家的犀利排雷。民意狂瀾與精妙的治國良策將你推上了權力的巔峰。基層選民的由衷擁護、歷史性福利法案的通過，或是外交談判上的縱橫捭闔，讓你成為了國家的脊梁，政壇滿意度高居不下，迎來了海量政治聲譽與榮光。,"財富:中性,快樂:中性,名譽:正向",稀有,"0,0,3"
從政,青年論壇的靈魂導師,青年論壇的靈魂導師。民意狂瀾與精妙的治國良策將你推上了權力的巔峰。基層選民的由衷擁護、歷史性福利法案的通過，或是外交談判上的縱橫捭闔，讓你成為了國家的脊梁，政壇滿意度高居不下，迎來了海量政治聲譽與榮光。,"財富:正向,快樂:中性,名譽:中性",稀有,"39,0,0"
從政,公益項目的閉環神蹟,公益項目的閉環神蹟。民意狂瀾與精妙的治國良策將你推上了權力的巔峰。基層選民的由衷擁護、歷史性福利法案的通過，或是外交談判上的縱橫捭闔，讓你成為了國家的脊梁，政壇滿意度高居不下，迎來了海量政治聲譽與榮光。,"財富:中性,快樂:正向,名譽:正向",稀有,"0,3,2"
從政,體制內的破格提拔,體制內的破格提拔。民意狂瀾與精妙的治國良策將你推上了權力的巔峰。基層選民的由衷擁護、歷史性福利法案的通過，或是外交談判上的縱橫捭闔，讓你成為了國家的脊梁，政壇滿意度高居不下，迎來了海量政治聲譽與榮光。,"財富:中性,快樂:正向,名譽:中性",稀有,"0,3,0"
從政,初心不改的靈魂慰藉,初心不改的靈魂慰藉。民意狂瀾與精妙的治國良策將你推上了權力的巔峰。基層選民的由衷擁護、歷史性福利法案的通過，或是外交談判上的縱橫捭闔，讓你成為了國家的脊梁，政壇滿意度高居不下，迎來了海量政治聲譽與榮光。,"財富:正向,快樂:中性,名譽:中性",稀有,"42,0,0"
從政,核心選區的集體倒戈危機,核心選區的集體倒戈危機。政治抹黑、派系鬥爭、刺客的冷槍或者核心幕僚的集體背叛，讓你身處波譎雲詭的權力漩渦邊緣。官僚內耗與不信任危機如影隨形，稍微踩錯一步棋便可能面臨免職下台乃至牢獄之災。,"財富:負向,快樂:中性,名譽:負向",稀有,"-31,0,-3"
從政,被惡意設計的腐敗陷阱,被惡意設計的腐敗陷阱。政治抹黑、派系鬥爭、刺客的冷槍或者核心幕僚的集體背叛，讓你身處波譎雲詭的權力漩渦邊緣。官僚內耗與不信任危機如影隨形，稍微踩錯一步棋便可能面臨免職下台乃至牢獄之災。,"財富:負向,快樂:中性,名譽:負向",稀有,"-32,0,-2"
從政,大選前夕的抹黑風暴,大選前夕的抹黑風暴。政治抹黑、派系鬥爭、刺客的冷槍或者核心幕僚的集體背叛，讓你身處波譎雲詭的權力漩渦邊緣。官僚內耗與不信任危機如影隨形，稍微踩錯一步棋便可能面臨免職下台乃至牢獄之災。,"財富:中性,快樂:中性,名譽:負向",稀有,"0,0,-2"
從政,派系鬥爭的替罪羊危機,派系鬥爭的替罪羊危機。政治抹黑、派系鬥爭、刺客的冷槍或者核心幕僚的集體背叛，讓你身處波譎雲詭的權力漩渦邊緣。官僚內耗與不信任危機如影隨形，稍微踩錯一步棋便可能面臨免職下台乃至牢獄之災。,"財富:中性,快樂:負向,名譽:負向",稀有,"0,-2,-2"
從政,引資項目的村民集體暴動,引資項目的村民集體暴動。政治抹黑、派系鬥爭、刺客的冷槍或者核心幕僚的集體背叛，讓你身處波譎雲詭的權力漩渦邊緣。官僚內耗與不信任危機如影隨形，稍微踩錯一步棋便可能面臨免職下台乃至牢獄之災。,"財富:中性,快樂:中性,名譽:負向",稀有,"0,0,-3"
從政,跨國犯罪集團的私下恐嚇,跨國犯罪集團的私下恐嚇。政治抹黑、派系鬥爭、刺客的冷槍或者核心幕僚的集體背叛，讓你身處波譎雲詭的權力漩渦邊緣。官僚內耗與不信任危機如影隨形，稍微踩錯一步棋便可能面臨免職下台乃至牢獄之災。,"財富:中性,快樂:中性,名譽:負向",稀有,"0,0,-3"
從政,街坊鄰里的自發擁護,街坊鄰里的自發擁護。民意狂瀾與精妙的治國良策將你推上了權力的巔峰。基層選民的由衷擁護、歷史性福利法案的通過，或是外交談判上的縱橫捭闔，讓你成為了國家的脊梁，政壇滿意度高居不下，迎來了海量政治聲譽與榮光。,"財富:正向,快樂:正向,名譽:正向",傳奇,"52,3,4"
從政,破冰的歷史性法案,破冰的歷史性法案。民意狂瀾與精妙的治國良策將你推上了權力的巔峰。基層選民的由衷擁護、歷史性福利法案的通過，或是外交談判上的縱橫捭闔，讓你成為了國家的脊梁，政壇滿意度高居不下，迎來了海量政治聲譽與榮光。,"財富:正向,快樂:正向,名譽:中性",傳奇,"59,4,0"
從政,深夜路燈下的擁抱,深夜路燈下的擁抱。民意狂瀾與精妙的治國良策將你推上了權力的巔峰。基層選民的由衷擁護、歷史性福利法案的通過，或是外交談判上的縱橫捭闔，讓你成為了國家的脊梁，政壇滿意度高居不下，迎來了海量政治聲譽與榮光。,"財富:正向,快樂:正向,名譽:正向",傳奇,"54,4,4"
從政,政府績效考核的驚喜第一,政府績效考核的驚喜第一。民意狂瀾與精妙的治國良策將你推上了權力的巔峰。基層選民的由衷擁護、歷史性福利法案的通過，或是外交談判上的縱橫捭闔，讓你成為了國家的脊梁，政壇滿意度高居不下，迎來了海量政治聲譽與榮光。,"財富:正向,快樂:正向,名譽:中性",傳奇,"58,3,0"
從政,跨國犯罪集團的私下恐嚇,跨國犯罪集團的私下恐嚇。政治抹黑、派系鬥爭、刺客的冷槍或者核心幕僚的集體背叛，讓你身處波譎雲詭的權力漩渦邊緣。官僚內耗與不信任危機如影隨形，稍微踩錯一步棋便可能面臨免職下台乃至牢獄之災。,"財富:負向,快樂:中性,名譽:負向",傳奇,"-41,0,-4"
電影明星,大導演的靈魂邀約,大導演的靈魂邀約。水銀燈下，你是萬眾矚目的焦點。大導演的靈魂邀約、國際影展的桂冠，或者現象級短影音帶來的爆發性流量，讓你的商業價值與藝術聲譽達到了巔峰，你的一言一行定義了潮流，成為一代人永恆的白月光。,"財富:正向,快樂:中性,名譽:中性",普通,"16,0,0"
電影明星,背台詞的深夜高光,背台詞的深夜高光。水銀燈下，你是萬眾矚目的焦點。大導演的靈魂邀約、國際影展的桂冠，或者現象級短影音帶來的爆發性流量，讓你的商業價值與藝術聲譽達到了巔峰，你的一言一行定義了潮流，成為一代人永恆的白月光。,"財富:正向,快樂:中性,名譽:中性",普通,"24,0,0"
電影明星,試鏡現場的掌聲,試鏡現場的掌聲。水銀燈下，你是萬眾矚目的焦點。大導演的靈魂邀約、國際影展的桂冠，或者現象級短影音帶來的爆發性流量，讓你的商業價值與藝術聲譽達到了巔峰，你的一言一行定義了潮流，成為一代人永恆的白月光。,"財富:中性,快樂:中性,名譽:正向",普通,"0,0,2"
電影明星,廣告代言的及時雨,廣告代言的及時雨。水銀燈下，你是萬眾矚目的焦點。大導演的靈魂邀約、國際影展的桂冠，或者現象級短影音帶來的爆發性流量，讓你的商業價值與藝術聲譽達到了巔峰，你的一言一行定義了潮流，成為一代人永恆的白月光。,"財富:中性,快樂:正向,名譽:中性",普通,"0,1,0"
電影明星,舞台劇的靈魂附體,舞台劇的靈魂附體。水銀燈下，你是萬眾矚目的焦點。大導演的靈魂邀約、國際影展的桂冠，或者現象級短影音帶來的爆發性流量，讓你的商業價值與藝術聲譽達到了巔峰，你的一言一行定義了潮流，成為一代人永恆的白月光。,"財富:中性,快樂:正向,名譽:中性",普通,"0,2,0"
電影明星,獨立短片的小奇蹟,獨立短片的小奇蹟。水銀燈下，你是萬眾矚目的焦點。大導演的靈魂邀約、國際影展的桂冠，或者現象級短影音帶來的爆發性流量，讓你的商業價值與藝術聲譽達到了巔峰，你的一言一行定義了潮流，成為一代人永恆的白月光。,"財富:中性,快樂:中性,名譽:正向",普通,"0,0,2"
電影明星,神級剪輯挽救神劇,神級剪輯挽救神劇。水銀燈下，你是萬眾矚目的焦點。大導演的靈魂邀約、國際影展的桂冠，或者現象級短影音帶來的爆發性流量，讓你的商業價值與藝術聲譽達到了巔峰，你的一言一行定義了潮流，成為一代人永恆的白月光。,"財富:中性,快樂:正向,名譽:中性",普通,"0,2,0"
電影明星,社群破圈的真心話,社群破圈的真心話。水銀燈下，你是萬眾矚目的焦點。大導演的靈魂邀約、國際影展的桂冠，或者現象級短影音帶來的爆發性流量，讓你的商業價值與藝術聲譽達到了巔峰，你的一言一行定義了潮流，成為一代人永恆的白月光。,"財富:中性,快樂:正向,名譽:中性",普通,"0,1,0"
電影明星,街頭抓拍的時尚焦點,街頭抓拍的時尚焦點。水銀燈下，你是萬眾矚目的焦點。大導演的靈魂邀約、國際影展的桂冠，或者現象級短影音帶來的爆發性流量，讓你的商業價值與藝術聲譽達到了巔峰，你的一言一行定義了潮流，成為一代人永恆的白月光。,"財富:中性,快樂:中性,名譽:正向",普通,"0,0,1"
電影明星,短影音的流量神話,短影音的流量神話。水銀燈下，你是萬眾矚目的焦點。大導演的靈魂邀約、國際影展的桂冠，或者現象級短影音帶來的爆發性流量，讓你的商業價值與藝術聲譽達到了巔峰，你的一言一行定義了潮流，成為一代人永恆的白月光。,"財富:中性,快樂:正向,名譽:中性",普通,"0,2,0"
電影明星,直播間的破紀錄打賞,直播間的破紀錄打賞。水銀燈下，你是萬眾矚目的焦點。大導演的靈魂邀約、國際影展的桂冠，或者現象級短影音帶來的爆發性流量，讓你的商業價值與藝術聲譽達到了巔峰，你的一言一行定義了潮流，成為一代人永恆的白月光。,"財富:中性,快樂:中性,名譽:正向",普通,"0,0,2"
電影明星,精製生活的素顏出圈,精製生活的素顏出圈。水銀燈下，你是萬眾矚目的焦點。大導演的靈魂邀約、國際影展的桂冠，或者現象級短影音帶來的爆發性流量，讓你的商業價值與藝術聲譽達到了巔峰，你的一言一行定義了潮流，成為一代人永恆的白月光。,"財富:正向,快樂:中性,名譽:中性",普通,"17,0,0"
電影明星,首個大牌彩妝的青睞,首個大牌彩妝的青睞。水銀燈下，你是萬眾矚目的焦點。大導演的靈魂邀約、國際影展的桂冠，或者現象級短影音帶來的爆發性流量，讓你的商業價值與藝術聲譽達到了巔峰，你的一言一行定義了潮流，成為一代人永恆的白月光。,"財富:正向,快樂:中性,名譽:中性",普通,"15,0,0"
電影明星,歡樂開台的友情局,歡樂開台的友情局。水銀燈下，你是萬眾矚目的焦點。大導演的靈魂邀約、國際影展的桂冠，或者現象級短影音帶來的爆發性流量，讓你的商業價值與藝術聲譽達到了巔峰，你的一言一行定義了潮流，成為一代人永恆的白月光。,"財富:中性,快樂:中性,名譽:正向",普通,"0,0,2"
電影明星,深夜電台的治癒聲音,深夜電台的治癒聲音。水銀燈下，你是萬眾矚目的焦點。大導演的靈魂邀約、國際影展的桂冠，或者現象級短影音帶來的爆發性流量，讓你的商業價值與藝術聲譽達到了巔峰，你的一言一行定義了潮流，成為一代人永恆的白月光。,"財富:中性,快樂:中性,名譽:正向",普通,"0,0,1"
電影明星,劇組大鍋飯的溫暖,劇組大鍋飯的溫暖。水銀燈下，你是萬眾矚目的焦點。大導演的靈魂邀約、國際影展的桂冠，或者現象級短影音帶來的爆發性流量，讓你的商業價值與藝術聲譽達到了巔峰，你的一言一行定義了潮流，成為一代人永恆的白月光。,"財富:正向,快樂:中性,名譽:中性",普通,"30,0,0"
電影明星,老戲骨的臨別贈言,老戲骨的臨別贈言。水銀燈下，你是萬眾矚目的焦點。大導演的靈魂邀約、國際影展的桂冠，或者現象級短影音帶來的爆發性流量，讓你的商業價值與藝術聲譽達到了巔峰，你的一言一行定義了潮流，成為一代人永恆的白月光。,"財富:中性,快樂:中性,名譽:正向",普通,"0,0,2"
電影明星,片場的驚險救火,片場的驚險救火。水銀燈下，你是萬眾矚目的焦點。大導演的靈魂邀約、國際影展的桂冠，或者現象級短影音帶來的爆發性流量，讓你的商業價值與藝術聲譽達到了巔峰，你的一言一行定義了潮流，成為一代人永恆的白月光。,"財富:中性,快樂:正向,名譽:中性",普通,"0,1,0"
電影明星,經典台詞的誕生,經典台詞的誕生。水銀燈下，你是萬眾矚目的焦點。大導演的靈魂邀約、國際影展的桂冠，或者現象級短影音帶來的爆發性流量，讓你的商業價值與藝術聲譽達到了巔峰，你的一言一行定義了潮流，成為一代人永恆的白月光。,"財富:中性,快樂:中性,名譽:正向",普通,"0,0,2"
電影明星,綜藝節目的搞笑爆擊,綜藝節目的搞笑爆擊。水銀燈下，你是萬眾矚目的焦點。大導演的靈魂邀約、國際影展的桂冠，或者現象級短影音帶來的爆發性流量，讓你的商業價值與藝術聲譽達到了巔峰，你的一言一行定義了潮流，成為一代人永恆的白月光。,"財富:中性,快樂:中性,名譽:正向",普通,"0,0,2"
電影明星,劇本改編的完美契合,劇本改編的完美契合。水銀燈下，你是萬眾矚目的焦點。大導演的靈魂邀約、國際影展的桂冠，或者現象級短影音帶來的爆發性流量，讓你的商業價值與藝術聲譽達到了巔峰，你的一言一行定義了潮流，成為一代人永恆的白月光。,"財富:正向,快樂:中性,名譽:中性",普通,"30,0,0"
電影明星,現象級收視率的加冕,現象級收視率的加冕。水銀燈下，你是萬眾矚目的焦點。大導演的靈魂邀約、國際影展的桂冠，或者現象級短影音帶來的爆發性流量，讓你的商業價值與藝術聲譽達到了巔峰，你的一言一行定義了潮流，成為一代人永恆的白月光。,"財富:中性,快樂:正向,名譽:中性",普通,"0,2,0"
電影明星,綜藝之王的全控場神蹟,綜藝之王的全控場神蹟。水銀燈下，你是萬眾矚目的焦點。大導演的靈魂邀約、國際影展的桂冠，或者現象級短影音帶來的爆發性流量，讓你的商業價值與藝術聲譽達到了巔峰，你的一言一行定義了潮流，成為一代人永恆的白月光。,"財富:中性,快樂:正向,名譽:中性",普通,"0,2,0"
電影明星,怪物聲優的靈魂解碼,怪物聲優的靈魂解碼。水銀燈下，你是萬眾矚目的焦點。大導演的靈魂邀約、國際影展的桂冠，或者現象級短影音帶來的爆發性流量，讓你的商業價值與藝術聲譽達到了巔峰，你的一言一行定義了潮流，成為一代人永恆的白月光。,"財富:中性,快樂:中性,名譽:正向",普通,"0,0,1"
電影明星,絕對自由的創作者宣言,絕對自由的創作者宣言。水銀燈下，你是萬眾矚目的焦點。大導演的靈魂邀約、國際影展的桂冠，或者現象級短影音帶來的爆發性流量，讓你的商業價值與藝術聲譽達到了巔峰，你的一言一行定義了潮流，成為一代人永恆的白月光。,"財富:正向,快樂:中性,名譽:中性",普通,"25,0,0"
電影明星,發燒榜第一的紀錄保持者,發燒榜第一的紀錄保持者。水銀燈下，你是萬眾矚目的焦點。大導演的靈魂邀約、國際影展的桂冠，或者現象級短影音帶來的爆發性流量，讓你的商業價值與藝術聲譽達到了巔峰，你的一言一行定義了潮流，成為一代人永恆的白月光。,"財富:中性,快樂:正向,名譽:中性",普通,"0,2,0"
電影明星,頂流帶貨女王的世紀神話,頂流帶貨女王的世紀神話。水銀燈下，你是萬眾矚目的焦點。大導演的靈魂邀約、國際影展的桂冠，或者現象級短影音帶來的爆發性流量，讓你的商業價值與藝術聲譽達到了巔峰，你的一言一行定義了潮流，成為一代人永恆的白月光。,"財富:中性,快樂:正向,名譽:中性",普通,"0,2,0"
電影明星,時尚風向球的最高禮遇,時尚風向球的最高禮遇。水銀燈下，你是萬眾矚目的焦點。大導演的靈魂邀約、國際影展的桂冠，或者現象級短影音帶來的爆發性流量，讓你的商業價值與藝術聲譽達到了巔峰，你的一言一行定義了潮流，成為一代人永恆的白月光。,"財富:中性,快樂:中性,名譽:正向",普通,"0,0,1"
