職業,事件名稱,事件內容,屬性,等級,影響
月球探險,穿過三十八萬公里的聲音,穿過三十八萬公里的聲音。邁向星辰，是人類文明最壯麗的史詩。低重力下的特技漫步、月壤中開出的希望綠芽，或是宇宙深處未知高等文明的友好接觸，讓你在月球背面建起百萬都市，代表地球守望整片璀璨銀河，點燃永不熄滅的火種。,"財富:正向,快樂:中性,名譽:中性",普通,"28,0,0"
月球探險,心靈監測的深夜溫柔,心靈監測的深夜溫柔。邁向星辰，是人類文明最壯麗的史詩。低重力下的特技漫步、月壤中開出的希望綠芽，或是宇宙深處未知高等文明的友好接觸，讓你在月球背面建起百萬都市，代表地球守望整片璀璨銀河，點燃永不熄滅的火種。,"財富:中性,快樂:正向,名譽:中性",普通,"0,2,0"
月球探險,陰影深谷的萬年冰川,陰影深谷的萬年冰川。邁向星辰，是人類文明最壯麗的史詩。低重力下的特技漫步、月壤中開出的希望綠芽，或是宇宙深處未知高等文明的友好接觸，讓你在月球背面建起百萬都市，代表地球守望整片璀璨銀河，點燃永不熄滅的火種。,"財富:中性,快樂:正向,名譽:中性",普通,"0,2,0"
月球探險,一鎬敲出純淨氦三金礦,一鎬敲出純淨氦三金礦。邁向星辰，是人類文明最壯麗的史詩。低重力下的特技漫步、月壤中開出的希望綠芽，或是宇宙深處未知高等文明的友好接觸，讓你在月球背面建起百萬都市，代表地球守望整片璀璨銀河，點燃永不熄滅的火種。,"財富:中性,快樂:中性,名譽:正向",普通,"0,0,1"
月球探險,星空守望者的隕石排雷,星空守望者的隕石排雷。邁向星辰，是人類文明最壯麗的史詩。低重力下的特技漫步、月壤中開出的希望綠芽，或是宇宙深處未知高等文明的友好接觸，讓你在月球背面建起百萬都市，代表地球守望整片璀璨銀河，點燃永不熄滅的火種。,"財富:中性,快樂:正向,名譽:中性",普通,"0,2,0"
月球探險,真空漫步的生死焊接,真空漫步的生死焊接。邁向星辰，是人類文明最壯麗的史詩。低重力下的特技漫步、月壤中開出的希望綠芽，或是宇宙深處未知高等文明的友好接觸，讓你在月球背面建起百萬都市，代表地球守望整片璀璨銀河，點燃永不熄滅的火種。,"財富:中性,快樂:正向,名譽:中性",普通,"0,2,0"
月球探險,月壤第一朵土豆花,月壤第一朵土豆花。邁向星辰，是人類文明最壯麗的史詩。低重力下的特技漫步、月壤中開出的希望綠芽，或是宇宙深處未知高等文明的友好接觸，讓你在月球背面建起百萬都市，代表地球守望整片璀璨銀河，點燃永不熄滅的火種。,"財富:中性,快樂:正向,名譽:中性",普通,"0,1,0"
月球探險,脈衝星的宇宙交響樂,脈衝星的宇宙交響樂。邁向星辰，是人類文明最壯麗的史詩。低重力下的特技漫步、月壤中開出的希望綠芽，或是宇宙深處未知高等文明的友好接觸，讓你在月球背面建起百萬都市，代表地球守望整片璀璨銀河，點燃永不熄滅的火種。,"財富:中性,快樂:中性,名譽:正向",普通,"0,0,2"
月球探險,鋼鐵閘門的生命守護,鋼鐵閘門的生命守護。邁向星辰，是人類文明最壯麗的史詩。低重力下的特技漫步、月壤中開出的希望綠芽，或是宇宙深處未知高等文明的友好接觸，讓你在月球背面建起百萬都市，代表地球守望整片璀璨銀河，點燃永不熄滅的火種。,"財富:正向,快樂:中性,名譽:中性",普通,"17,0,0"
月球探險,星海天使的輻射抗體,星海天使的輻射抗體。邁向星辰，是人類文明最壯麗的史詩。低重力下的特技漫步、月壤中開出的希望綠芽，或是宇宙深處未知高等文明的友好接觸，讓你在月球背面建起百萬都市，代表地球守望整片璀璨銀河，點燃永不熄滅的火種。,"財富:正向,快樂:中性,名譽:中性",普通,"17,0,0"
月球探險,月面基地的巨型升級加冕,月面基地的巨型升級加冕。邁向星辰，是人類文明最壯麗的史詩。低重力下的特技漫步、月壤中開出的希望綠芽，或是宇宙深處未知高等文明的友好接觸，讓你在月球背面建起百萬都市，代表地球守望整片璀璨銀河，點燃永不熄滅的火種。,"財富:中性,快樂:正向,名譽:中性",普通,"0,1,0"
月球探險,軌道幾何學的星海改命,軌道幾何學的星海改命。邁向星辰，是人類文明最壯麗的史詩。低重力下的特技漫步、月壤中開出的希望綠芽，或是宇宙深處未知高等文明的友好接觸，讓你在月球背面建起百萬都市，代表地球守望整片璀璨銀河，點燃永不熄滅的火種。,"財富:中性,快樂:中性,名譽:正向",普通,"0,0,2"
月球探險,數字先知的太陽風暴排雷,數字先知的太陽風暴排雷。邁向星辰，是人類文明最壯麗的史詩。低重力下的特技漫步、月壤中開出的希望綠芽，或是宇宙深處未知高等文明的友好接觸，讓你在月球背面建起百萬都市，代表地球守望整片璀璨銀河，點燃永不熄滅的火種。,"財富:正向,快樂:中性,名譽:中性",普通,"16,0,0"
月球探險,古老冰層裡的史前地外生命,古老冰層裡的史前地外生命。邁向星辰，是人類文明最壯麗的史詩。低重力下的特技漫步、月壤中開出的希望綠芽，或是宇宙深處未知高等文明的友好接觸，讓你在月球背面建起百萬都市，代表地球守望整片璀璨銀河，點燃永不熄滅的火種。,"財富:中性,快樂:中性,名譽:正向",普通,"0,0,2"
月球探險,太空開顱的海星神蹟,太空開顱的海星神蹟。邁向星辰，是人類文明最壯麗的史詩。低重力下的特技漫步、月壤中開出的希望綠芽，或是宇宙深處未知高等文明的友好接觸，讓你在月球背面建起百萬都市，代表地球守望整片璀璨銀河，點燃永不熄滅的火種。,"財富:中性,快樂:中性,名譽:正向",普通,"0,0,1"
月球探險,直面虛無的鋼鐵心智,直面虛無的鋼鐵心智。邁向星辰，是人類文明最壯麗的史詩。低重力下的特技漫步、月壤中開出的希望綠芽，或是宇宙深處未知高等文明的友好接觸，讓你在月球背面建起百萬都市，代表地球守望整片璀璨銀河，點燃永不熄滅的火種。,"財富:中性,快樂:正向,名譽:中性",普通,"0,2,0"
月球探險,異星遭遇的至高外交宣言,異星遭遇的至高外交宣言。邁向星辰，是人類文明最壯麗的史詩。低重力下的特技漫步、月壤中開出的希望綠芽，或是宇宙深處未知高等文明的友好接觸，讓你在月球背面建起百萬都市，代表地球守望整片璀璨銀河，點燃永不熄滅的火種。,"財富:中性,快樂:中性,名譽:正向",普通,"0,0,2"
月球探險,地月貿易的金色天平,地月貿易的金色天平。邁向星辰，是人類文明最壯麗的史詩。低重力下的特技漫步、月壤中開出的希望綠芽，或是宇宙深處未知高等文明的友好接觸，讓你在月球背面建起百萬都市，代表地球守望整片璀璨銀河，點燃永不熄滅的火種。,"財富:中性,快樂:中性,名譽:正向",普通,"0,0,1"
月球探險,星際獵手的小行星套索,星際獵手的小行星套索。邁向星辰，是人類文明最壯麗的史詩。低重力下的特技漫步、月壤中開出的希望綠芽，或是宇宙深處未知高等文明的友好接觸，讓你在月球背面建起百萬都市，代表地球守望整片璀璨銀河，點燃永不熄滅的火種。,"財富:中性,快樂:正向,名譽:中性",普通,"0,2,0"
月球探險,未知威脅的月背武裝大捷,未知威脅的月背武裝大捷。邁向星辰，是人類文明最壯麗的史詩。低重力下的特技漫步、月壤中開出的希望綠芽，或是宇宙深處未知高等文明的友好接觸，讓你在月球背面建起百萬都市，代表地球守望整片璀璨銀河，點燃永不熄滅的火種。,"財富:中性,快樂:正向,名譽:中性",普通,"0,1,0"
月球探險,地月雙星的至高主權王座,地月雙星的至高主權王座。邁向星辰，是人類文明最壯麗的史詩。低重力下的特技漫步、月壤中開出的希望綠芽，或是宇宙深處未知高等文明的友好接觸，讓你在月球背面建起百萬都市，代表地球守望整片璀璨銀河，點燃永不熄滅的火種。,"財富:中性,快樂:中性,名譽:正向",普通,"0,0,1"
月球探險,穿越黑洞事件視界的不朽傳奇,穿越黑洞事件視界的不朽傳奇。邁向星辰，是人類文明最壯麗的史詩。低重力下的特技漫步、月壤中開出的希望綠芽，或是宇宙深處未知高等文明的友好接觸，讓你在月球背面建起百萬都市，代表地球守望整片璀璨銀河，點燃永不熄滅的火種。,"財富:正向,快樂:中性,名譽:中性",普通,"30,0,0"
月球探險,室女座超星系團的火種啟航,室女座超星系團的火種啟航。邁向星辰，是人類文明最壯麗的史詩。低重力下的特技漫步、月壤中開出的希望綠芽，或是宇宙深處未知高等文明的友好接觸，讓你在月球背面建起百萬都市，代表地球守望整片璀璨銀河，點燃永不熄滅的火種。,"財富:正向,快樂:中性,名譽:中性",普通,"18,0,0"
月球探險,月球背面主權都市的獨立加冕,月球背面主權都市的獨立加冕。邁向星辰，是人類文明最壯麗的史詩。低重力下的特技漫步、月壤中開出的希望綠芽，或是宇宙深處未知高等文明的友好接觸，讓你在月球背面建起百萬都市，代表地球守望整片璀璨銀河，點燃永不熄滅的火種。,"財富:中性,快樂:正向,名譽:中性",普通,"0,2,0"
月球探險,第三類接觸的宇宙和平使者,第三類接觸的宇宙和平使者。邁向星辰，是人類文明最壯麗的史詩。低重力下的特技漫步、月壤中開出的希望綠芽，或是宇宙深處未知高等文明的友好接觸，讓你在月球背面建起百萬都市，代表地球守望整片璀璨銀河，點燃永不熄滅的火種。,"財富:正向,快樂:中性,名譽:中性",普通,"23,0,0"
月球探險,永恆地星的絕美日出,永恆地星的絕美日出。邁向星辰，是人類文明最壯麗的史詩。低重力下的特技漫步、月壤中開出的希望綠芽，或是宇宙深處未知高等文明的友好接觸，讓你在月球背面建起百萬都市，代表地球守望整片璀璨銀河，點燃永不熄滅的火種。,"財富:中性,快樂:中性,名譽:正向",普通,"0,0,1"
月球探險,低重力特技漫步,低重力特技漫步。邁向星辰，是人類文明最壯麗的史詩。低重力下的特技漫步、月壤中開出的希望綠芽，或是宇宙深處未知高等文明的友好接觸，讓你在月球背面建起百萬都市，代表地球守望整片璀璨銀河，點燃永不熄滅的火種。,"財富:中性,快樂:正向,名譽:中性",普通,"0,1,0"
月球探險,微重力垃圾變廢為寶,微重力垃圾變廢為寶。邁向星辰，是人類文明最壯麗的史詩。低重力下的特技漫步、月壤中開出的希望綠芽，或是宇宙深處未知高等文明的友好接觸，讓你在月球背面建起百萬都市，代表地球守望整片璀璨銀河，點燃永不熄滅的火種。,"財富:中性,快樂:中性,名譽:正向",普通,"0,0,2"
月球探險,生命管道的生死三十秒,生命管道的生死三十秒。邁向星辰，是人類文明最壯麗的史詩。低重力下的特技漫步、月壤中開出的希望綠芽，或是宇宙深處未知高等文明的友好接觸，讓你在月球背面建起百萬都市，代表地球守望整片璀璨銀河，點燃永不熄滅的火種。,"財富:正向,快樂:中性,名譽:中性",普通,"20,0,0"
月球探險,太空卡路里的精準神話,太空卡路里的精準神話。邁向星辰，是人類文明最壯麗的史詩。低重力下的特技漫步、月壤中開出的希望綠芽，或是宇宙深處未知高等文明的友好接觸，讓你在月球背面建起百萬都市，代表地球守望整片璀璨銀河，點燃永不熄滅的火種。,"財富:中性,快樂:正向,名譽:中性",普通,"0,2,0"
月球探險,外星微生物的基地大感染,外星微生物的基地大感染。核反應堆融毀危機、流星群對氣閘艙的穿透、外星厭氧微生物的大面積感染或者地月通訊的百年大中斷，讓封閉的月球基地危在旦夕。面對零下一百八十度的死寂真空與宇宙射線，你必須在絕境中手動鎖死閘門。,"財富:中性,快樂:負向,名譽:中性",普通,"0,-1,0"
月球探險,星際貿易的世紀大爆倉,星際貿易的世紀大爆倉。核反應堆融毀危機、流星群對氣閘艙的穿透、外星厭氧微生物的大面積感染或者地月通訊的百年大中斷，讓封閉的月球基地危在旦夕。面對零下一百八十度的死寂真空與宇宙射線，你必須在絕境中手動鎖死閘門。,"財富:負向,快樂:中性,名譽:中性",普通,"-20,0,0"
月球探險,小行星牽引的軌道失控災難,小行星牽引的軌道失控災難。核反應堆融毀危機、流星群對氣閘艙的穿透、外星厭氧微生物的大面積感染或者地月通訊的百年大中斷，讓封閉的月球基地危在旦夕。面對零下一百八十度的死寂真空與宇宙射線，你必須在絕境中手動鎖死閘門。,"財富:負向,快樂:中性,名譽:中性",普通,"-13,0,0"
月球探險,太陽耀斑引發的強烈艙外射線灼傷,太陽耀斑引發的強烈艙外射線灼傷。核反應堆融毀危機、流星群對氣閘艙的穿透、外星厭氧微生物的大面積感染或者地月通訊的百年大中斷，讓封閉的月球基地危在旦夕。面對零下一百八十度的死寂真空與宇宙射線，你必須在絕境中手動鎖死閘門。,"財富:負向,快樂:中性,名譽:中性",普通,"-21,0,0"
月球探險,月面車在永夜陰影區的意外翻車,月面車在永夜陰影區的意外翻車。核反應堆融毀危機、流星群對氣閘艙的穿透、外星厭氧微生物的大面積感染或者地月通訊的百年大中斷，讓封閉的月球基地危在旦夕。面對零下一百八十度的死寂真空與宇宙射線，你必須在絕境中手動鎖死閘門。,"財富:中性,快樂:中性,名譽:負向",普通,"0,0,-2"
月球探險,生命維持系統主機的AI代碼叛變,生命維持系統主機的AI代碼叛變。核反應堆融毀危機、流星群對氣閘艙的穿透、外星厭氧微生物的大面積感染或者地月通訊的百年大中斷，讓封閉的月球基地危在旦夕。面對零下一百八十度的死寂真空與宇宙射線，你必須在絕境中手動鎖死閘門。,"財富:負向,快樂:中性,名譽:中性",普通,"-19,0,0"
月球探險,地球總部意外切斷了所有的後續經費支援,地球總部意外切斷了所有的後續經費支援。核反應堆融毀危機、流星群對氣閘艙的穿透、外星厭氧微生物的大面積感染或者地月通訊的百年大中斷，讓封閉的月球基地危在旦夕。面對零下一百八十度的死寂真空與宇宙射線，你必須在絕境中手動鎖死閘門。,"財富:中性,快樂:負向,名譽:中性",普通,"0,-1,0"
月球探險,未知地外高頻雜音引發的全體精神錯亂,未知地外高頻雜音引發的全體精神錯亂。核反應堆融毀危機、流星群對氣閘艙的穿透、外星厭氧微生物的大面積感染或者地月通訊的百年大中斷，讓封閉的月球基地危在旦夕。面對零下一百八十度的死寂真空與宇宙射線，你必須在絕境中手動鎖死閘門。,"財富:中性,快樂:負向,名譽:中性",普通,"0,-1,0"
月球探險,基地氣壓泵在睡眠週期的突發停擺,基地氣壓泵在睡眠週期的突發停擺。核反應堆融毀危機、流星群對氣閘艙的穿透、外星厭氧微生物的大面積感染或者地月通訊的百年大中斷，讓封閉的月球基地危在旦夕。面對零下一百八十度的死寂真空與宇宙射線，你必須在絕境中手動鎖死閘門。,"財富:負向,快樂:中性,名譽:中性",普通,"-14,0,0"
月球探險,太空艙內因極度孤獨爆發的流血衝突,太空艙內因極度孤獨爆發的流血衝突。核反應堆融毀危機、流星群對氣閘艙的穿透、外星厭氧微生物的大面積感染或者地月通訊的百年大中斷，讓封閉的月球基地危在旦夕。面對零下一百八十度的死寂真空與宇宙射線，你必須在絕境中手動鎖死閘門。,"財富:中性,快樂:負向,名譽:中性",普通,"0,-1,0"
月球探險,氣閘艙的突發大洩漏,氣閘艙的突發大洩漏。核反應堆融毀危機、流星群對氣閘艙的穿透、外星厭氧微生物的大面積感染或者地月通訊的百年大中斷，讓封閉的月球基地危在旦夕。面對零下一百八十度的死寂真空與宇宙射線，你必須在絕境中手動鎖死閘門。,"財富:中性,快樂:中性,名譽:負向",普通,"0,0,-2"
月球探險,地月通訊的歷史性大中斷,地月通訊的歷史性大中斷。核反應堆融毀危機、流星群對氣閘艙的穿透、外星厭氧微生物的大面積感染或者地月通訊的百年大中斷，讓封閉的月球基地危在旦夕。面對零下一百八十度的死寂真空與宇宙射線，你必須在絕境中手動鎖死閘門。,"財富:負向,快樂:中性,名譽:中性",普通,"-21,0,0"
月球探險,低重力骨質疏鬆的職涯判決,低重力骨質疏鬆的職涯判決。核反應堆融毀危機、流星群對氣閘艙的穿透、外星厭氧微生物的大面積感染或者地月通訊的百年大中斷，讓封閉的月球基地危在旦夕。面對零下一百八十度的死寂真空與宇宙射線，你必須在絕境中手動鎖死閘門。,"財富:負向,快樂:中性,名譽:中性",普通,"-24,0,0"
月球探險,微重力核反應堆的融毀危機,微重力核反應堆的融毀危機。核反應堆融毀危機、流星群對氣閘艙的穿透、外星厭氧微生物的大面積感染或者地月通訊的百年大中斷，讓封閉的月球基地危在旦夕。面對零下一百八十度的死寂真空與宇宙射線，你必須在絕境中手動鎖死閘門。,"財富:中性,快樂:中性,名譽:負向",普通,"0,0,-2"
月球探險,星艦大副的宇宙幽閉集體瘋狂,星艦大副的宇宙幽閉集體瘋狂。核反應堆融毀危機、流星群對氣閘艙的穿透、外星厭氧微生物的大面積感染或者地月通訊的百年大中斷，讓封閉的月球基地危在旦夕。面對零下一百八十度的死寂真空與宇宙射線，你必須在絕境中手動鎖死閘門。,"財富:中性,快樂:負向,名譽:中性",普通,"0,-1,0"
月球探險,永恆地星的絕美日出,永恆地星的絕美日出。邁向星辰，是人類文明最壯麗的史詩。低重力下的特技漫步、月壤中開出的希望綠芽，或是宇宙深處未知高等文明的友好接觸，讓你在月球背面建起百萬都市，代表地球守望整片璀璨銀河，點燃永不熄滅的火種。,"財富:中性,快樂:正向,名譽:正向",稀有,"0,3,3"
月球探險,低重力特技漫步,低重力特技漫步。邁向星辰，是人類文明最壯麗的史詩。低重力下的特技漫步、月壤中開出的希望綠芽，或是宇宙深處未知高等文明的友好接觸，讓你在月球背面建起百萬都市，代表地球守望整片璀璨銀河，點燃永不熄滅的火種。,"財富:中性,快樂:中性,名譽:正向",稀有,"0,0,2"
月球探險,微重力垃圾變廢為寶,微重力垃圾變廢為寶。邁向星辰，是人類文明最壯麗的史詩。低重力下的特技漫步、月壤中開出的希望綠芽，或是宇宙深處未知高等文明的友好接觸，讓你在月球背面建起百萬都市，代表地球守望整片璀璨銀河，點燃永不熄滅的火種。,"財富:正向,快樂:正向,名譽:中性",稀有,"39,3,0"
月球探險,生命管道的生死三十秒,生命管道的生死三十秒。邁向星辰，是人類文明最壯麗的史詩。低重力下的特技漫步、月壤中開出的希望綠芽，或是宇宙深處未知高等文明的友好接觸，讓你在月球背面建起百萬都市，代表地球守望整片璀璨銀河，點燃永不熄滅的火種。,"財富:正向,快樂:中性,名譽:正向",稀有,"42,0,4"
月球探險,太空卡路里的精準神話,太空卡路里的精準神話。邁向星辰，是人類文明最壯麗的史詩。低重力下的特技漫步、月壤中開出的希望綠芽，或是宇宙深處未知高等文明的友好接觸，讓你在月球背面建起百萬都市，代表地球守望整片璀璨銀河，點燃永不熄滅的火種。,"財富:正向,快樂:中性,名譽:中性",稀有,"36,0,0"
月球探險,穿過三十八萬公里的聲音,穿過三十八萬公里的聲音。邁向星辰，是人類文明最壯麗的史詩。低重力下的特技漫步、月壤中開出的希望綠芽，或是宇宙深處未知高等文明的友好接觸，讓你在月球背面建起百萬都市，代表地球守望整片璀璨銀河，點燃永不熄滅的火種。,"財富:正向,快樂:中性,名譽:正向",稀有,"38,0,3"
月球探險,心靈監測的深夜溫柔,心靈監測的深夜溫柔。邁向星辰，是人類文明最壯麗的史詩。低重力下的特技漫步、月壤中開出的希望綠芽，或是宇宙深處未知高等文明的友好接觸，讓你在月球背面建起百萬都市，代表地球守望整片璀璨銀河，點燃永不熄滅的火種。,"財富:正向,快樂:中性,名譽:正向",稀有,"45,0,4"
月球探險,陰影深谷的萬年冰川,陰影深谷的萬年冰川。邁向星辰，是人類文明最壯麗的史詩。低重力下的特技漫步、月壤中開出的希望綠芽，或是宇宙深處未知高等文明的友好接觸，讓你在月球背面建起百萬都市，代表地球守望整片璀璨銀河，點燃永不熄滅的火種。,"財富:正向,快樂:中性,名譽:正向",稀有,"42,0,4"
月球探險,一鎬敲出純淨氦三金礦,一鎬敲出純淨氦三金礦。邁向星辰，是人類文明最壯麗的史詩。低重力下的特技漫步、月壤中開出的希望綠芽，或是宇宙深處未知高等文明的友好接觸，讓你在月球背面建起百萬都市，代表地球守望整片璀璨銀河，點燃永不熄滅的火種。,"財富:中性,快樂:中性,名譽:正向",稀有,"0,0,4"
月球探險,星空守望者的隕石排雷,星空守望者的隕石排雷。邁向星辰，是人類文明最壯麗的史詩。低重力下的特技漫步、月壤中開出的希望綠芽，或是宇宙深處未知高等文明的友好接觸，讓你在月球背面建起百萬都市，代表地球守望整片璀璨銀河，點燃永不熄滅的火種。,"財富:正向,快樂:正向,名譽:中性",稀有,"31,3,0"
月球探險,真空漫步的生死焊接,真空漫步的生死焊接。邁向星辰，是人類文明最壯麗的史詩。低重力下的特技漫步、月壤中開出的希望綠芽，或是宇宙深處未知高等文明的友好接觸，讓你在月球背面建起百萬都市，代表地球守望整片璀璨銀河，點燃永不熄滅的火種。,"財富:中性,快樂:正向,名譽:中性",稀有,"0,2,0"
月球探險,月壤第一朵土豆花,月壤第一朵土豆花。邁向星辰，是人類文明最壯麗的史詩。低重力下的特技漫步、月壤中開出的希望綠芽，或是宇宙深處未知高等文明的友好接觸，讓你在月球背面建起百萬都市，代表地球守望整片璀璨銀河，點燃永不熄滅的火種。,"財富:中性,快樂:正向,名譽:正向",稀有,"0,3,4"
月球探險,脈衝星的宇宙交響樂,脈衝星的宇宙交響樂。邁向星辰，是人類文明最壯麗的史詩。低重力下的特技漫步、月壤中開出的希望綠芽，或是宇宙深處未知高等文明的友好接觸，讓你在月球背面建起百萬都市，代表地球守望整片璀璨銀河，點燃永不熄滅的火種。,"財富:正向,快樂:正向,名譽:中性",稀有,"42,2,0"
月球探險,鋼鐵閘門的生命守護,鋼鐵閘門的生命守護。邁向星辰，是人類文明最壯麗的史詩。低重力下的特技漫步、月壤中開出的希望綠芽，或是宇宙深處未知高等文明的友好接觸，讓你在月球背面建起百萬都市，代表地球守望整片璀璨銀河，點燃永不熄滅的火種。,"財富:正向,快樂:正向,名譽:中性",稀有,"41,2,0"
月球探險,太空艙內因極度孤獨爆發的流血衝突,太空艙內因極度孤獨爆發的流血衝突。核反應堆融毀危機、流星群對氣閘艙的穿透、外星厭氧微生物的大面積感染或者地月通訊的百年大中斷，讓封閉的月球基地危在旦夕。面對零下一百八十度的死寂真空與宇宙射線，你必須在絕境中手動鎖死閘門。,"財富:負向,快樂:中性,名譽:負向",稀有,"-22,0,-2"
月球探險,氣閘艙的突發大洩漏,氣閘艙的突發大洩漏。核反應堆融毀危機、流星群對氣閘艙的穿透、外星厭氧微生物的大面積感染或者地月通訊的百年大中斷，讓封閉的月球基地危在旦夕。面對零下一百八十度的死寂真空與宇宙射線，你必須在絕境中手動鎖死閘門。,"財富:中性,快樂:負向,名譽:中性",稀有,"0,-2,0"
